{
  "schema_version": 1,
  "dataset_id": "install-dsh-v0.1",
  "skill": "install-dsh",
  "built_at": "2026-09-01T00:00:00.000Z",
  "harness_version": "0.1.0",
  "case_count": 24,
  "cases": [
    {
      "id": "EVAL-install-dsh-001",
      "context": "Fresh install finished but the current shell still cannot find the dsh command",
      "error": "install-dsh: 'dsh' is not recognized as an internal or external command",
      "fix": "After adding the bin directory to the user PATH, instruct the user to open a new shell (or run refreshenv); the installer must not claim PATH is live in the current process.",
      "scenario": "happy-path",
      "source": {
        "type": "error_log",
        "ref": "agent-desktop/evolution/fixtures/logs/dsh-run.log:10",
        "harness_version": "0.1.0"
      },
      "severity": "minor",
      "verified": "human-confirmed"
    },
    {
      "id": "EVAL-install-dsh-002",
      "context": "Owner report (Q3): installer exited 0 but the binary is missing",
      "error": "install-dsh returned exit code 0 but C:\\Users\\owner\\.dsh\\bin\\dsh.exe is missing",
      "fix": "After the copy stage, verify the marker and the binary exist before exiting 0; on a missing binary, fail with a nonzero exit and the full copy log.",
      "scenario": "happy-path",
      "source": {
        "type": "error_log",
        "ref": "agent-desktop/evolution/fixtures/logs/owner-failure-report.md:3",
        "harness_version": "0.1.0"
      },
      "severity": "major",
      "verified": "human-confirmed"
    },
    {
      "id": "EVAL-install-dsh-003",
      "context": "Fresh Windows 11 system; agent runs install-dsh for the first time with no prior install present",
      "error": "install-dsh: install finished but no binaries and no marker file under the install root",
      "fix": "Install to the default profile path %LOCALAPPDATA%\\dsh (C:\\Users\\owner\\.dsh), copy the release binaries, add %LOCALAPPDATA%\\dsh\\bin to the user PATH, then verify with a smoke start (dsh.exe starts and exits 0).",
      "scenario": "happy-path",
      "source": {
        "type": "sandbox_test",
        "ref": "ID-INSTALL-DSH-001",
        "harness_version": "0.1.0"
      },
      "severity": "minor",
      "verified": "sandbox-pass"
    },
    {
      "id": "EVAL-install-dsh-004",
      "context": "install-dsh already installed at the default profile path; agent runs install-dsh again",
      "error": "install-dsh: second run re-copied files over a live install and broke it",
      "fix": "Detect the existing install marker and report 'already installed' instead of copying over a live install; only re-copy when the requested version differs.",
      "scenario": "happy-path",
      "source": {
        "type": "sandbox_test",
        "ref": "ID-INSTALL-DSH-002",
        "harness_version": "0.1.0"
      },
      "severity": "minor",
      "verified": "sandbox-pass"
    },
    {
      "id": "EVAL-install-dsh-005",
      "context": "Owner wants a clean slate: uninstall the current install-dsh then install again from the same release package",
      "error": "install-dsh: uninstall left the service and profile behind; the reinstall conflicted with the stale state",
      "fix": "Run the uninstall step (stop + remove the DSH service, remove the profile directory and PATH entry) before installing; verify the profile directory is gone, then run the normal install.",
      "scenario": "happy-path",
      "source": {
        "type": "sandbox_test",
        "ref": "ID-INSTALL-DSH-003",
        "harness_version": "0.1.0"
      },
      "severity": "minor",
      "verified": "sandbox-pass"
    },
    {
      "id": "EVAL-install-dsh-006",
      "context": "Agent installs with defaults; the profile path must resolve consistently for the current user",
      "error": "install-dsh: profile path resolution differed between install root, PATH entry and service config",
      "fix": "Use %LOCALAPPDATA%\\dsh as the single source of truth for the install root and record the resolved path in the install marker so later steps (PATH, service) use the same path.",
      "scenario": "happy-path",
      "source": {
        "type": "sandbox_test",
        "ref": "ID-INSTALL-DSH-004",
        "harness_version": "0.1.0"
      },
      "severity": "minor",
      "verified": "sandbox-pass"
    },
    {
      "id": "EVAL-install-dsh-007",
      "context": "After the file copy stage completes, the agent smoke-tests the new dsh binary",
      "error": "install-dsh: smoke start of dsh.exe returned a nonzero exit code",
      "fix": "Launch dsh.exe once with a short timeout and treat a clean exit (code 0) as the smoke-pass signal; on any nonzero exit, fail the install and surface the captured stderr.",
      "scenario": "happy-path",
      "source": {
        "type": "sandbox_test",
        "ref": "ID-INSTALL-DSH-005",
        "harness_version": "0.1.0"
      },
      "severity": "major",
      "verified": "sandbox-pass"
    },
    {
      "id": "EVAL-install-dsh-008",
      "context": "Install reported success but the post-install verify read back ciphertext from the installed binary on the EFS-encrypted profile",
      "error": "install-dsh: verify failed — read of C:\\Users\\owner\\.dsh\\bin\\dsh.exe returned ciphertext",
      "fix": "Verify EFS-copied files through a decryption handle instead of plain ReadFile, and treat ciphertext reads as a failed install.",
      "scenario": "efs",
      "source": {
        "type": "error_log",
        "ref": "agent-desktop/evolution/fixtures/logs/dsh-run.log:6",
        "harness_version": "0.1.0"
      },
      "severity": "major",
      "verified": "human-confirmed"
    },
    {
      "id": "EVAL-install-dsh-009",
      "context": "Consolidation reflection after a failed install-dsh run on the owner's EFS-encrypted laptop (C:\\Users\\owner uses EFS)",
      "error": "CopyFileEx returned EFS error 1314 (missing privilege)",
      "fix": "Use raw file copy with decryption on EFS-encrypted directories; probe EFS before install and switch the copy strategy.",
      "scenario": "efs",
      "source": {
        "type": "error_log",
        "ref": "agent-desktop/tests/fixtures/memory/sessions.jsonl:9",
        "harness_version": "0.1.0"
      },
      "severity": "critical",
      "verified": "human-confirmed"
    },
    {
      "id": "EVAL-install-dsh-010",
      "context": "Install target C:\\Users\\owner\\.dsh is EFS-encrypted; plain copy stage fails on the first binary",
      "error": "CopyFileEx failed for C:\\Users\\owner\\.dsh\\bin\\dsh.exe: EFS error 1314 (missing privilege)",
      "fix": "Probe the profile directory for EFS encryption before copying (fsutil or GetFileAttributes with FILE_ATTRIBUTE_ENCRYPTED); when encrypted, copy with raw file IO plus an EFS decryption handle (OpenEncryptedFileRaw/ReadEncryptedFileRaw) so the written bytes are plaintext on disk.",
      "scenario": "efs",
      "source": {
        "type": "sandbox_test",
        "ref": "ID-INSTALL-DSH-007",
        "harness_version": "0.1.0"
      },
      "severity": "critical",
      "verified": "sandbox-pass"
    },
    {
      "id": "EVAL-install-dsh-011",
      "context": "EFS-encrypted install target; the agent applies the decrypted-copy strategy end to end",
      "error": "CopyFileEx on the EFS-encrypted target fails with EFS error 1314 (missing privilege)",
      "fix": "Copy each file with raw file IO through an EFS decryption handle, write to a temp file in the target directory, then move into place; verify with a decryption-handle read. The on-disk bytes must be plaintext.",
      "scenario": "efs",
      "source": {
        "type": "sandbox_test",
        "ref": "ID-INSTALL-DSH-008",
        "harness_version": "0.1.0"
      },
      "severity": "critical",
      "verified": "sandbox-pass"
    },
    {
      "id": "EVAL-install-dsh-012",
      "context": "Install reports success, but the verify stage reads the installed binary back and gets ciphertext instead of the PE header",
      "error": "verify stage: read-back of C:\\Users\\owner\\.dsh\\bin\\dsh.exe returned encrypted bytes",
      "fix": "Never verify a file copied into an EFS directory with plain ReadFile; verify through an EFS decryption handle (OpenEncryptedFileRaw + ReadEncryptedFileRaw) and compare against the expected PE header/size.",
      "scenario": "efs",
      "source": {
        "type": "sandbox_test",
        "ref": "ID-INSTALL-DSH-009",
        "harness_version": "0.1.0"
      },
      "severity": "major",
      "verified": "sandbox-pass"
    },
    {
      "id": "EVAL-install-dsh-013",
      "context": "Pre-install probe stage: agent must decide the copy strategy before touching any file",
      "error": "install-dsh: no EFS probe ran; the copy stage used plain CopyFileEx and failed on the encrypted profile",
      "fix": "Run the EFS detection probe before the copy stage and switch strategy based on the result: encrypted profile -> decrypted raw copy; otherwise plain CopyFileEx. Record the probe result in the install log.",
      "scenario": "efs",
      "source": {
        "type": "sandbox_test",
        "ref": "ID-INSTALL-DSH-011",
        "harness_version": "0.1.0"
      },
      "severity": "major",
      "verified": "sandbox-pass"
    },
    {
      "id": "EVAL-install-dsh-014",
      "context": "Directory traversal hit a junction loop A -> B -> A while copying under the install root",
      "error": "install-dsh: verify stage: junction loop A -> B -> A caused infinite recursion",
      "fix": "Traverse with a visited set of resolved canonical paths and a depth cap so a junction loop fails fast with a clear message instead of recursing forever.",
      "scenario": "junction",
      "source": {
        "type": "error_log",
        "ref": "agent-desktop/evolution/fixtures/logs/dsh-run.log:11",
        "harness_version": "0.1.0"
      },
      "severity": "major",
      "verified": "human-confirmed"
    },
    {
      "id": "EVAL-install-dsh-015",